Carimbo de data/hora,Nome do Responsável:,Nome Completo do Atleta:,Idade do Atleta:,O que motivou você a procurar o treinamento específico de futebol Mindsoccer?,Como você avalia a evolução do seu filho(a) desde que iniciou os treinos comigo nas seguintes áreas? [Parte Técnica (Habilidades com a bola)],"Como você avalia a evolução do seu filho(a) desde que iniciou os treinos comigo nas seguintes áreas? [Parte Mental (Foco, Confiança, Tomada de Decisão em jogo)]",Seu filho(a) demonstra motivação e prazer em vir aos treinos? Como ele(a) costuma falar sobre o processo de treinamento em casa?,"De 0 a 5, qual nota você daria para o meu trabalho e a experiência geral?",Compartilhe agora um pequeno depoimento do que você acha sobre os treinamentos,De 0 a 10 o quanto você indicaria meu treinamento específico para outros atletas?,Coluna 9
19/01/2026 17:02:46,Sidiney Cesar de Faria ,Sidiney Cesar de Faria ,46,"Condicionamento físico , sair da rotina ",Excelente Evolução,Excelente Evolução,"Sim , com certeza , queria fazer mais vezes na semana kk",5,"Muito profissional , dedicado , pontual que incentiva tempo todo ",10,
02/02/2026 20:39:27,Guilherme,Matheus Capobiango Romano Ferreira,11,Aperfeicoar fundamentos e contato maior com o esporte,Excelente Evolução,Excelente Evolução,Sempre fica contando os dias pra ir,5,Tenho muito que agradecer... de coracao! Nota 1000!,10,
03/02/2026 12:38:53,Fabrício Souza,Bernardo Garcia Teixeira ,08,"Buscar evolução tática, técnica e psicológica ",Excelente Evolução,Excelente Evolução,"Sim, e muito. Ele fala com muito orgulho de sentir que ele consegue desenvolver as atividades e com isso vai percebendo que a proposta feita pelo Mindsoccer está fazendo ele evoluir.",5,"A proposta de treinamento traz uma lógica de processo de evolução macro, e as atividades ofertadas cumpre muito bem o que foi proposto. Pude perceber um evolução tatica, técnica e de maturidade, uma postura mais efetiva em campo. Trabalho muito bem conduzido!",10,
04/02/2026 18:38:09,Andréia ,Pietro Borges Walker ,9 anos,Busca na evolução para um melhor desempenho nos campeonatos e autoconfiança. ,Excelente Evolução,Excelente Evolução,Sim,5,"Bom, o Lucas é um excelente profissional e ser humano. Sempre atualizado, trazendo o melhor para seus atletas. No caso do meu filho fez um ótimo trabalho, tanto na parte física quanto mental. Ele sabe identificar e trabalhar a parte individual de cada um.
Só tenho à agradecer. ",10,
11/02/2026 19:49:18,Sheila Gomes Ferreira Passos ,Gabriel Ferreira Passos ,11 anos,Aperfeiçoamento qto as técnicas de futebol. ,Excelente Evolução,Excelente Evolução,Demonstra. Sempre q está em JF pede p agendar aulas. Em casa refaz o q aprendeu.,5,"Lucas é um excelente profissional,  além da técnica trabalha o emocional e autoconfiança da criança. Considero-o um profissional completo. Gabriel sempre pede suas, qdo está em jF.",10,
18/02/2026 19:03:34,Igor Firmino ,Miguel Henrique ,7,Foi as oportunidades de time grande chamar meu filho para avaliação .,Excelente Evolução,Evolução Moderada,Demonstra muito motivação e prazer em ir aos treinos. Ele comenta sobre gols feitos no treinamento ,5,"Acho os treinamentos fundamental para evoluir e melhorar atributos físicos, técnicos e táticos",10,
05/03/2026 15:19:37,Bruner Filgueiras,Eduardo Teixeira Filgueiras,8,Aprimoramento dos fundamentos do futebol,Evolução Moderada,Evolução Moderada,Na maioria das vezes,5,"Lucas é um professor dedicado e muito didático, atencioso e excelente profissional.",10,